"id","code","abbreviation","name","name_with_abbreviation","short_description","long_description"
1,"evoeu","EvoEU","Evolution of European Union Law Database","Evolution of European Union Law (EvoEU) Database","A collection of data on the network of EU law, including primary law, secondary law, and case law.","The Evolution of European Union Law (EvoEU) Database contains network data on the near-universe of legal documents in the acquis communautaire of the European Union (EU), including primary law, secondary law, and case law, and various types of links between documents (1951-2015). The database includes a nodes dataset and a links dataset."
2,"ecio","ECIO","European Commission Internal Organization Database","European Commission Internal Organization (ECIO) Database","A collection of data on the internal organization of the Commission, including data on commissioners and departments.","The European Commission Internal Organization (ECIO) Database contains data on each commission of the European Commission, including data on commissioners, departments (Directorates-General and service departments), and commissioner portfolios (1958-2021). The database includes 11 datasets."
3,"euip","EUIP","European Union Infringement Procedure Database","European Union Infringement Procedure (EUIP) Database","A collection of data on Commission infringement cases and decisions in infringement cases. ","The European Union Infringement Procedure (EUIP) Database contains data on the European Commission infringement procedure, including data on infringement cases and decisions in infringement cases (2002-2020). The EUIP Database is part of the European Union Compliance Project (EUCP). The database includes 22 datasets, including time-series, cross-sectional time-series, directed dyad-year, and network data."
4,"eusa","EUSA","European Union State Aid Database","European Union State Aid (EUSA) Database","A collection of data on Commission state aid cases and state aid awards granted by EU member states. ","The European Union State Aid (EUSA) Database contains data on state aid in the European Union (EU), including data on European Commission state aid cases (2000-2020), decisions in state aid cases (2000-2020), and state aid awards granted by member states (2016-2020). The EUSA Database is part of the European Union Compliance Project (EUCP). The database includes 27 datasets, including time-series, cross-sectional time-series, directed dyad-year, and network data."
5,"eutr","EUTR","European Union Technical Regulation Database","European Union Technical Regulation (EUTR) Database","A collection of data on technical regulations proposed by EU member states.","The European Union Technical Regulations (EUTR) Database contains data on technical regulations proposed by European Union (EU) member states, including data on notifications of proposed technical regulations and comments and detailed opinions submitted by third-party member states and institutions under the 2015/1535 procedure (1986-2020). The EUTR Database is part of the European Union Compliance Project (EUCP). The database includes 15 datasets, including time-series, cross-sectional time-series, directed dyad-year, and network data."
6,"eums","EUMS","European Union Member State Database","European Union Member State (EUMS) Database","A collection of data on EU member states, including data on accession dates, legal obligations, and opt-outs.","The European Union Member State (EUMS) Database contains general data on European Union (EU) member states, including data on accession, domestic political systems, membership in the European Economic and Monetary Union (EMU) and Schengen Area, legal obligations and opt-outs, and membership in other international organizations. The database includes 4 datasets."
